{
  "protocolVersion": "0.4",
  "id": "acceptance_fixture",
  "ownerId": "owner_fixture",
  "revision": 1,
  "outcome": {
    "id": "outcome_fixture",
    "revision": 1
  },
  "evidenceSetDigest": "sha256:f16d05ec6b29248d2c61adb1e9263f78e4f7bace1b955014a2d17872cfe4064d",
  "verificationIds": [
    "verification_fixture"
  ],
  "actor": {
    "kind": "owner",
    "id": "owner_fixture"
  },
  "mode": "explicit_owner",
  "delegatedPolicyRevision": null,
  "decision": "accepted",
  "reasonRef": null,
  "recordedAt": "2026-08-13T12:03:00.000Z"
}
